{
  "tier": "tier_1c",
  "name": "Antigravity",
  "profile_version": "2.0.0",
  "model_tiers_version": "2026-05-19",
  "aspirational": true,
  "capabilities": {
    "subagents": true,
    "parallel_subagents": true,
    "task_primitive": false,
    "skill_tool": true,
    "worktrees": false,
    "reviewer_isolation": "convention",
    "dispatch_mechanism": "model_driven",
    "dynamic_subagents": true,
    "model_field_format": "omit",
    "effort_field_name": null,
    "effort_field_applies_to_providers": null,
    "subagent_env_override": null,
    "subagent_inherit_target": "orchestrator",
    "provider_families": ["google"]
  },
  "scope_root": {
    "workspace": ".agents",
    "user": "~/.antigravity"
  },
  "degradation_warnings": [
    "Antigravity uses dynamic subagents — per-step model assignment is not supported. Only the orchestrator's model tier is user-configurable. Subagent model selection is owned by Antigravity's orchestrator."
  ],
  "extensions": {
    "default_orchestrator_model": "gemini-3.5-flash",
    "subagent_model_control": "orchestrator-only"
  },
  "model_tiers": {
    "triage": { "model": "gemini-3.5-flash", "effort": "low" },
    "fast":   { "model": "gemini-3.5-flash", "effort": "medium" },
    "medium": { "model": "gemini-3.5-pro",   "effort": "medium" },
    "deep":   { "model": "gemini-3.5-pro",   "effort": "high" }
  }
}
