{
  "tier": "tier_2",
  "name": "Cursor / Windsurf / Cline",
  "profile_version": "2.0.0",
  "model_tiers_version": "2026-05-19",
  "capabilities": {
    "subagents": false,
    "parallel_subagents": false,
    "task_primitive": false,
    "skill_tool": true,
    "worktrees": false,
    "reviewer_isolation": "convention",
    "dispatch_mechanism": "inline",
    "dynamic_subagents": false,
    "model_field_format": "omit",
    "effort_field_name": null,
    "effort_field_applies_to_providers": null,
    "subagent_env_override": null,
    "subagent_inherit_target": "session",
    "provider_families": []
  },
  "scope_root": {
    "workspace": ".superpipelines",
    "user": "~/.superpipelines"
  },
  "degradation_warnings": [
    "Reviewer isolation is convention-only; reviews are advisory, not structurally enforced.",
    "Parallel fan-out (Pattern 2) degrades to sequential.",
    "Iterative pattern (Pattern 3) cycle limit still enforced inline.",
    "Model selection is owned by the host IDE; per-step model assignment is not emitted."
  ],
  "extensions": {
    "skill_tool_note": "Cursor, Windsurf, and Cline load skill content via file read or prompt injection, not a native Skill() primitive. The skill_tool capability flag is treated as equivalent for routing purposes in this profile."
  },
  "model_tiers": {
    "triage": { "model": "inherit", "effort": null },
    "fast":   { "model": "inherit", "effort": null },
    "medium": { "model": "inherit", "effort": null },
    "deep":   { "model": "inherit", "effort": null }
  }
}
